{
  "applianceId": 10,
  "name": "Kitchen Kettle",
  "type": "KETTLE",
  "currentPowerWatts": 1850.4,
  "accumulatedEnergyKwh": 0.0148,
  "accumulatedCost": 0.0414,
  "operatingState": "ON",
  "safePowerLimitWatts": 2200,
  "consecutiveBreachCount": 0,
  "healthStatus": "NORMAL",
  "lastUpdatedAt": "2026-07-21T12:00:01Z"
}
